RecordID,Name,NameAlphabetized,OperationalStatus,OrganizationType,Description,URL,AlternateOrFormerNames,Acronym,AlternateOrFormerAcronyms,BudgetCode,OpenDatasetsURL,FoundingYear,PrincipalOfficerName,PrincipalOfficerTitle,PrincipalOfficerContactURL,Notes,InstanceOf,Name - NYC.gov Agency List,Name - NYC.gov Mayor's Office,Name - NYC Open Data Portal,Name - ODA,Name - CPO,Name - WeGov,Name - Greenbook,Name - Checkbook,Name - HOO,Name - Ops,NYC.gov Agency Directory,Jan 2025 Org Chart,PrincipalOfficerFullName,PrincipalOfficerGivenName,PrincipalOfficerMiddleNameOrInitial,PrincipalOfficerFamilyName,PrincipalOfficerSuffix,InOrgChart,ReportsTo,ReportingNotes
NYC_GOID_000000,NYC311,NYC311,Active,Division,,https://portal.311.nyc.gov/,311,311,,,,2003.0,Joseph Morrisroe,Deputy Commissioner,,,,,,,,,NYC 311,,,,311,True,True,Joseph Morrisroe,Joseph,,Morrisroe,,TRUE,Office of Technology and Innovation,
NYC_GOID_000001,Accessory Sign Regulation Interagency Task Force,Accessory Sign Regulation Interagency Task Force,Dissolved,Advisory or Regulatory Organization,,,,,,,,,,,,,,,,,,,,,,,Accessory Sign Regulation Interagency Task Force,False,False,,,,,,,,
NYC_GOID_000002,Administration for Children's Services,"Children's Services, Administration for",Active,Mayoral Agency,"The Administration for Children's Services (ACS) protects and ensures the well-being of New York City's children and families. ACS investigated child abuse and neglect reports involving approximately 79,000 children and provided contract preventive services to a daily average of 27,000 children. ACS provides direct foster care and adoption services, as well as contractual services for approximately 17,000 children through 44 foster care agencies Citywide. The Agency also administers 263 Head Start sites and enrolls 57,000 children in child care programs through contracted providers or child care vouchers.",https://www.nyc.gov/site/acs/index.page,,ACS,,068,https://data.cityofnewyork.us/browse?Dataset-Information_Agency=Administration+for+Children%27s+Services+%28ACS%29,1996.0,Jess Dannhauser,Commissioner,https://www.nyc.gov/site/acs/about/contact-acs.page,,,"Children's Services, Administration for (ACS)","Children's Services, Administration for (ACS)",Administration for Children's Services (ACS),Administration for Children's Services (ACS),Administration for Children's Services,Administration for Children's Services,"Children's Services, Administration for",Administration for Children's Services,"Children's Services, Administration for (ACS)",Administration for Children's Services,True,True,Jess Dannhauser,Jess,,Dannhauser,,TRUE,Deputy Mayor for Health and Human Services,
NYC_GOID_000003,Advisory Board on Implementation of Racial Justice Charter Amendments,"Implementation of Racial Justice Charter Amendments, Advisory Board on",Active,Advisory or Regulatory Organization,,,,,,,,,Sideya Sherman,Chief Equity Officer and Commissioner,,,,,,,,,,,,,Advisory Board on Implementation of Racial Justice Charter Amendments,False,False,Sideya Sherman,Sideya,,Sherman,,,,
NYC_GOID_000004,Advisory Commission on Property Tax Reform,"Property Tax Reform, Advisory Commission on",Dissolved,Advisory or Regulatory Organization,"This site is up for historical purposes only. The New York City Advisory Commission on Property Tax Reform worked to evaluate all aspects of the current property tax system in New York City and recommend reforms to make it fairer, simpler, and more transparent, while ensuring that there is no reduction in revenue used to fund City services.",https://www.nyc.gov/site/propertytaxreform/index.page,,,,,,2018.0,Marc V. Shaw,Chair,,,,"Property Tax Reform, Advisory Commission on","Property Tax Reform, Advisory Commission on",,,,,,,"Property Tax Reform, Advisory Commission on",Advisory Commission on Property Tax Reform,False,False,Marc V. Shaw,Marc,V.,Shaw,,,,
NYC_GOID_000005,Advisory Committee on Female Genital Mutilation and Cutting,"Female Genital Mutilation and Cutting, Advisory Committee on",Active,Advisory or Regulatory Organization,,,,,,,,,,,,,,,,,,,,,,,Advisory Committee on Female Genital Mutilation and Cutting,False,False,,,,,,,,
NYC_GOID_000006,Advisory Council to the Center for Workplace Accessibility and Inclusion,"Center for Workplace Accessibility and Inclusion, Advisory Council to",Active,Advisory or Regulatory Organization,,,,,,,,,,,,,,,,,,,,,,,Advisory Council to the Center for Workplace Accessibility and Inclusion,True,False,,,,,,,,
NYC_GOID_000007,Advisory Council to the Department for the Aging,"Aging, Advisory Council to the Department for the",Active,Advisory or Regulatory Organization,,https://www.nyc.gov/site/dfta/about/advisory-council.page,,,,,,,Lorraine Cortés-Vázquez,Commissioner,,,,,,,,,,,,,,True,False,Lorraine Cortés-Vázquez,Lorraine,,Cortés-Vázquez,,,,
NYC_GOID_000008,Advisory Council for the NYC Civil Court Housing Part,"NYC Civil Court Housing Part, Advisory Council for",Active,Advisory or Regulatory Organization,,https://ww2.nycourts.gov/courts/nyc/housing/advisory.shtml,,,,,,,,,,,,,,,,,,,,,Advisory Council for the NYC Civil Court Housing Part,True,False,,,,,,,,
NYC_GOID_000009,Advisory Council on Procurement Lobbying,"Procurement Lobbying, Advisory Council on",Active,Advisory or Regulatory Organization,,https://ogs.ny.gov/ACPL/,,,,,,,,,,,,,,,,,,,,,Advisory Council on Procurement Lobbying,False,False,,,,,,,,
NYC_GOID_000010,Age Friendly Commission,Age Friendly Commission,Active,Advisory or Regulatory Organization,,,,,,,,,,,,,,,,,,,,,,,Age Friendly Commission,False,False,,,,,,,,
NYC_GOID_000011,Algorithm Advisory Committee,Algorithm Advisory Committee,Dissolved,Advisory or Regulatory Organization,,https://www1.nyc.gov/site/ampo/committees/advisory-committee.page,,,,,,,,,,,,,,,,,,,,,Algorithm Advisory Committee,False,False,,,,,,,,
NYC_GOID_000012,Animal Care Centers of NYC,Animal Care Centers of NYC,Active,Nonprofit Organization,,https://www.nycacc.org/,,,,,,,Risa Weinstock,Chief Executive Officer,,,,,,,,,,,,,Animal Care Centers of NYC,False,False,Risa Weinstock,Risa,,Weinstock,,,,
NYC_GOID_000014,"Archives, Reference and Research Advisory Board","Archives, Reference and Research Advisory Board",Active,Advisory or Regulatory Organization,,https://www.nyc.gov/site/records/about/archives-reference-and-research-advisory-board.page,,,,,,,,,,,,,,,,,,,,,"Archives, Reference and Research Advisory Board ",False,False,,,,,,,,
NYC_GOID_000015,Association for a Better New York,Association for a Better New York,Active,Nonprofit Organization,,https://abny.org/,,ABNY,,,,1971.0,Melva M. Miller,Chief Executive Officer,,,,,,,Association for a Better New York (ABNY),,,,,,,False,False,Melva M. Miller,Melva,M.,Miller,,,,
NYC_GOID_000016,Atlantic Yards Community Development Corporation,Atlantic Yards Community Development Corporation,Active,Public Benefit or Development Organization,,https://esd.ny.gov/atlantic-yards-community-development-corporation,,,,,,,,,,,,,,,,,,,,,Atlantic Yards Community Development Corporation (AYCDC),False,False,,,,,,,,
NYC_GOID_000017,Audit Committee,Audit Committee,Active,Advisory or Regulatory Organization,,https://nycauditcommittee.org/,,AUDIT,,,,1979.0,Tobi Jaiyesimi,Executive Director and Atlantic Yards Project Director,,,,,,,,,,,,,Audit Committee,True,False,Tobi Jaiyesimi,Tobi,,Jaiyesimi,,,,
NYC_GOID_000018,Banking Commission,Banking Commission,Active,Advisory or Regulatory Organization,,https://www.nyc.gov/site/finance/about/banking-commission.page,,,,,,,,,,,,,,,,,,,,,Banking Commission,True,False,,,,,,,,
NYC_GOID_000019,Black Car and Livery Task Force,"Black Car and Livery, Task Force",Active,Advisory or Regulatory Organization,,,,,,,,,,,,,,,,,,,,,,,Black Car and Livery Task Force,False,False,,,,,,,,
NYC_GOID_000021,Board of Correction,"Correction, Board of",Active,Advisory or Regulatory Organization,"The NYC Board of Correction establishes and ensures compliance with minimum standards regulating conditions of confinement and correctional health and mental health care in all City correctional facilities. The Board monitors conditions in the City's jails, investigates serious incidents, evaluates the performance of the Department of Correction, reviews inmate and employee grievances, and makes recommendations in critical areas of correctional planning.",https://www.nyc.gov/site/boc/index.page,,BOC,,073,,1957.0,Jasmine Georges-Yilla,Interim Executive Director,https://www.nyc.gov/site/boc/about/contact-the-executive-director.page,,,"Correction, Board of (BOC)","Correction, Board of (BOC)",,Board of Correction (BOC),Board of Correction,Board of Correction,"Correction, Board of",Board of Correction,"Correction, Board of (BOC)",Board of Correction,True,True,Jasmine Georges-Yilla,Jasmine,,Georges-Yilla,,,,
NYC_GOID_000022,Board of Education Retirement System,"Education Retirement System, Board of",Active,Advisory or Regulatory Organization,"The New York City Board of Education Retirement System (BERS) was founded on August 31, 1921, and is one of the five public pension funds of New York City. The benefits that BERS provides include service retirement benefits, disability retirement benefits, death benefits, and a Tax-Deferred Annuity (TDA) program. BERS is one of the largest multi-employer, multi-tiered retirement systems in the United States. Our members are employed in such agencies as the Department of Education, the School Construction Authority, and the Police Department.",https://www.bers.nyc.gov/,,BERS,,,,1921.0,Sanford Rich,Executive Director,https://www.bers.nyc.gov/site/bers/about/email-bers.page,,,Board of Education Retirement System (BERS),Board of Education Retirement System (BERS),,Board of Education Retirement System (BERS),Board of Education Retirement System,Board of Education Retirement System,"Education Retirement System, Board of",,Board of Education Retirement System (BERS),,True,False,Sanford Rich,Sanford,,Rich,,,,
NYC_GOID_000023,Board of Elections,"Elections, Board of",Active,Advisory or Regulatory Organization,"The Board of Elections is an administrative body of 10 bipartisan Commissioners, two from each borough, appointed by the City Council for a term of four years. The Board oversees voter, poll site, and campaign-related issues",https://vote.nyc/,,BOE,,003,https://data.cityofnewyork.us/browse?Dataset-Information_Agency=Board+of+Elections+%28BOENY%29,1974.0,Simon Shamoun,President,https://vote.nyc/page/contact-us,,,"Elections, Board of (BOE)","Elections, Board of (BOE)",Board of Elections (BOENY),Board of Elections (BOE),,Board of Elections,"Elections, Board of",Board of Elections,"Elections, Board of (BOE)",Board of Elections,True,False,Simon Shamoun,Simon,,Shamoun,,,,
NYC_GOID_000024,Board of Health,"Health, Board of",Active,Advisory or Regulatory Organization,,https://www1.nyc.gov/site/doh/about/about-doh/board-of-health.page,,,,,,1805.0,Michelle Morse,Acting Health Commissioner,,,,,,,,,,,,,Board of Health,True,False,Michelle Morse,Michelle,,Morse,,,,
NYC_GOID_000025,Board of Standards and Appeals,"Standards and Appeals, Board of",Active,Advisory or Regulatory Organization,The Board of Standards and Appeals hears and decides appeals from property owners whose various building and renovation applications have been denied as contrary to law by the enforcement agencies.,https://www.nyc.gov/site/bsa/index.page,,BSA,,,https://data.cityofnewyork.us/browse?Dataset-Information_Agency=Board+of+Standards+and+Appeals+%28BSA%29&category=City+Government,1916.0,Shampa Chanda,Executive Director,https://www.nyc.gov/site/bsa/contact-bsa/send-a-message-to-chair.page,,,"Standards and Appeals, Board of (BSA)","Standards and Appeals, Board of (BSA)",Board of Standards and Appeals (BSA),Board of Standards and Appeals (BSA),Board of Standards and Appeals,Board of Standards And Appeals,"Standards And Appeals, Board of",,"Standards and Appeals, Board of (BSA)",Board of Standards and Appeals,True,False,Shampa Chanda,Shampa,,Chanda,,,,
NYC_GOID_000026,Office of the Borough President of The Bronx,"Borough President, Bronx",Active,Elected Office,The Borough Presidents are the executive officials of each borough. The City Charter gives them authority to: work with the Mayor in preparing the annual executive budget submitted to the City Council and to propose borough budget priorities directly to the council; review and comment on major land use decisions and propose sites for city facilities within their respective boroughs; monitor and modify the delivery of city services within their boroughs; and engage in strategic planning for their boroughs.,https://bronxboropres.nyc.gov/,,,,011,https://data.cityofnewyork.us/browse?Dataset-Information_Agency=Bronx+Borough+President+%28BPBX%29,1898.0,Vanessa L. Gibson,Bronx Borough President,https://bronxboropres.nyc.gov/contact/,,,,,,,,,,,Borough President- Bronx,Boro President Bronx,True,True,Vanessa L. Gibson,Vanessa,L.,Gibson,,TRUE,,
NYC_GOID_000027,Office of the Borough President of Brooklyn,"Borough President, Brooklyn",Active,Elected Office,The Borough Presidents are the executive officials of each borough. The City Charter gives them authority to: work with the Mayor in preparing the annual executive budget submitted to the City Council and to propose borough budget priorities directly to the council; review and comment on major land use decisions and propose sites for city facilities within their respective boroughs; monitor and modify the delivery of city services within their boroughs; and engage in strategic planning for their boroughs.,https://www.brooklynbp.nyc.gov/,,,,012,https://data.cityofnewyork.us/browse?Dataset-Information_Agency=Brooklyn+Borough+President+%28BPBK%29,1898.0,Antonio Reynoso,Brooklyn Borough President,https://www.brooklynbp.nyc.gov/contact/,,,,,,,,,,,Borough President- Brooklyn,Boro President Brooklyn,True,True,Antonio Reynoso,Antonio,,Reynoso,,TRUE,,
NYC_GOID_000028,Office of the Borough President of Manhattan,"Borough President, Manhattan",Active,Elected Office,The Borough Presidents are the executive officials of each borough. The City Charter gives them authority to: work with the Mayor in preparing the annual executive budget submitted to the City Council and to propose borough budget priorities directly to the council; review and comment on major land use decisions and propose sites for city facilities within their respective boroughs; monitor and modify the delivery of city services within their boroughs; and engage in strategic planning for their boroughs.,https://www.manhattanbp.nyc.gov/,,,,010,https://data.cityofnewyork.us/browse?Dataset-Information_Agency=Manhattan+Borough+President+%28MBPO%29,1898.0,Mark D. Levine,Manhattan Borough President,https://www.manhattanbp.nyc.gov/connect/,,,,,,,,,,,Borough President- Manhattan,Boro President Manhattan,True,True,Mark D. Levine,Mark,D.,Levine,,TRUE,,
NYC_GOID_000029,Office of the Borough President of Queens,"Borough President, Queens",Active,Elected Office,The Borough Presidents are the executive officials of each borough. The City Charter gives them authority to: work with the Mayor in preparing the annual executive budget submitted to the City Council and to propose borough budget priorities directly to the council; review and comment on major land use decisions and propose sites for city facilities within their respective boroughs; monitor and modify the delivery of city services within their boroughs; and engage in strategic planning for their boroughs.,https://www.queensbp.nyc.gov/,,,,013,https://data.cityofnewyork.us/browse?Dataset-Information_Agency=Queens+Borough+President+%28QBP%29,1898.0,Donovan J. Richards Jr.,Queens Borough President,https://www.queensbp.nyc.gov/,,,,,,,,,,,Borough President- Queens,Boro President Queens,True,True,Donovan J. Richards Jr.,Donovan,J.,Richards,Jr.,TRUE,,
NYC_GOID_000030,Office of the Borough President of Staten Island,"Borough President, Staten Island",Active,Elected Office,The Borough Presidents are the executive officials of each borough. The City Charter gives them authority to: work with the Mayor in preparing the annual executive budget submitted to the City Council and to propose borough budget priorities directly to the council; review and comment on major land use decisions and propose sites for city facilities within their respective boroughs; monitor and modify the delivery of city services within their boroughs; and engage in strategic planning for their boroughs.,https://www.statenislandusa.com/bp-office.html,,,,014,https://data.cityofnewyork.us/browse?Dataset-Information_Agency=Staten+Island+Borough+President+%28BPSI%29,1898.0,Vito J. Fossella,Staten Island Borough President,https://www.statenislandusa.com/contact.html,,,,,,,,,,,Borough President- Staten Island,Boro President Staten Island,True,True,Vito J. Fossella,Vito,J.,Fossella,,TRUE,,
NYC_GOID_000034,Brooklyn Bridge Park Corporation,Brooklyn Bridge Park Corporation,Active,Public Benefit or Development Organization,,https://brooklynbridgepark.org/about/brooklyn-bridge-park-corporation/,,BBPC,,,,2010.0,Eric Landau,President,,,,,,,,,,Brooklyn Bridge Park Corporation,,,Brooklyn Bridge Park Corporation,True,False,Eric Landau,Eric,,Landau,,,,
NYC_GOID_000035,Brooklyn Bridge Park Development Corporation,Brooklyn Bridge Park Development Corporation,Dissolved,Public Benefit or Development Organization,,https://esd.ny.gov/brooklyn-bridge-park-development-corporation-subsidiary,,,,,,,,,,,,,,,,,,,,,Brooklyn Bridge Park Development Corporation,False,False,,,,,,,,
NYC_GOID_000036,Brooklyn Marine Terminal Task Force,Brooklyn Marine Terminal Task Force,Active,Advisory or Regulatory Organization,,,,,,,,,,,,,,,,,,,,,,,Brooklyn Marine Terminal Task Force,False,False,,,,,,,,
NYC_GOID_000037,Brooklyn Navy Yard Development Corporation,Brooklyn Navy Yard Development Corporation,Active,Public Benefit or Development Organization,"The Brooklyn Navy Yard (the Yard) is a mission-driven industrial park that is a nationally acclaimed model of the viability and positive impact of modern, urban industrial development. The Yard is home to 450+ businesses employing more than 11,000 people and generating over $2.5 billion per year in economic impact for the city. Building on the Yard's history as the economic heart of Brooklyn, the 300-acre waterfront asset offers a critical pathway to the middle class for many New Yorkers.",https://www.brooklynnavyyard.org/,,BNYDC,,,,1981.0,Lindsay Greene,Chief Executive Officer,https://www.brooklynnavyyard.org/,,,Brooklyn Navy Yard,Brooklyn Navy Yard,,Brooklyn Navy Yard Development Corporation (BNYDC),,,Brooklyn Navy Yard Development Corporation,,Brooklyn Navy Yard,Brooklyn Navy Yard Development Corporation,True,False,Lindsay Greene,Lindsay,,Greene,,,,
NYC_GOID_000038,Brooklyn Public Library,"Public Library, Brooklyn",Active,Nonprofit Organization,,https://www.bklynlibrary.org/,,BPL,,038,https://data.cityofnewyork.us/browse?Dataset-Information_Agency=Brooklyn+Public+Library+%28BPL%29,1896.0,Linda E. Johnson,President and CEO,https://www.bklynlibrary.org/contact,,,"Brooklyn Public Library (BPL); Library, Brooklyn Public (BPL)","Brooklyn Public Library (BPL); Library, Brooklyn Public (BPL)",Brooklyn Public Library (BPL),Brooklyn Public Library (BPL),,Brooklyn Public Library,Brooklyn Public Library,Brooklyn Public Library,"Brooklyn Public Library (BPL); Library, Brooklyn Public (BPL)",Brooklyn Public Library,False,False,Linda E. Johnson,Linda,E.,Johnson,,,,
NYC_GOID_000040,Business Integrity Commission,Business Integrity Commission,Active,Advisory or Regulatory Organization,"The Business Integrity Commission is responsible for the regulation of the trade waste industry, the shipboard gambling industry, the Fulton Fish Market distribution area and other seafood distribution areas, and the public wholesale markets. The Commission consists of a full-time chairperson appointed by the Mayor and of the Commissioners of the Departments of Small Business Services, Consumer Affairs, Investigation, Sanitation, and the Police Department.",https://www.nyc.gov/site/bic/index.page,,BIC,,829,https://data.cityofnewyork.us/browse?Dataset-Information_Agency=Business+Integrity+Commission+%28BIC%29,2002.0,Elizabeth Crotty,Commissioner/Chair,https://www.nyc.gov/site/bic/contact/email-the-commissioner.page,,,Business Integrity Commission (BIC),Business Integrity Commission (BIC),Business Integrity Commission (BIC),Business Integrity Commission (BIC),Business Integrity Commission,Business Integrity Commission,Business Integrity Commission,Business Integrity Commission,Business Integrity Commission (BIC),Business Integrity Commission,True,True,Elizabeth Crotty,Elizabeth,,Crotty,,TRUE,Chief Counsel to the Mayor and City Hall,
NYC_GOID_000041,Cabinet for Older New Yorkers,Cabinet for Older New Yorkers,Active,Advisory or Regulatory Organization,,,,,,,,2022.0,,,,,,,,,,,,,,,,False,False,,,,,,,,
NYC_GOID_000042,Campaign Finance Board,Campaign Finance Board,Active,Advisory or Regulatory Organization,"The Campaign Finance Board administers the City Campaign Finance Program, publishes the City Voter Guide, and implements the debate requirement for candidates running for Mayor, Comptroller, and Public Advocate.",https://www.nyccfb.info/,,CFB,,004,https://data.cityofnewyork.us/browse?Dataset-Information_Agency=Campaign+Finance+Board+%28CFB%29,1988.0,Frederick Schaffer,Executive Director,http://www.nyccfb.info/about/contact,,,Campaign Finance Board (CFB),Campaign Finance Board (CFB),Campaign Finance Board (CFB),Campaign Finance Board (CFB),Campaign Finance Board,Campaign Finance Board,Campaign Finance Board,Campaign Finance Board,Campaign Finance Board (CFB),Campaign Finance Board,True,False,Frederick Schaffer,Frederick,,Schaffer,,,,
NYC_GOID_000043,Cannabis Advisory Council,Cannabis Advisory Council,Active,Advisory or Regulatory Organization,,,,,,,,,Tremaine Wright,Chair,,,,,,,,,,,,,Cannabis Advisory Council,False,False,Tremaine Wright,Tremaine,,Wright,,,,
NYC_GOID_000044,Caribbean Advisory Council,Caribbean Advisory Council,Active,Advisory or Regulatory Organization,,,,,,,,,,,,,,,,,,,,,,,Caribbean Advisory Council,False,False,,,,,,,,
NYC_GOID_000045,Catskill Watershed Corporation,Catskill Watershed Corporation,Active,Public Benefit or Development Organization,,https://cwconline.org/,,,,,,,Jason Merwin,Executive Director,,,,,,,,,,,,,Catskill Watershed Corporation,True,False,Jason Merwin,Jason,,Merwin,,,,
NYC_GOID_000047,Center for Innovation through Data Intelligence,Center for Innovation through Data Intelligence,Active,Mayoral Office,"The Center for Innovation through Data Intelligence (CIDI) is a data intelligence team in the Office of the Deputy Mayor for Health and Human Services (HHS), Office of the Mayor, who establishes partnerships that can leverage the analytical resources of the City of New York through an innovative inter-agency research agenda. This position affords CIDI greater access to data and ensures persons' confidentiality in its research activities.",https://www.nyc.gov/site/cidi/index.page,,CIDI,,002,,2011.0,MaryAnne Schretzman,Executive Director,https://www.nyc.gov/site/cidi/contact/contact.page,,,Center for Innovation through Data Intelligence (CIDI),Center for Innovation through Data Intelligence (CIDI),,Center for Innovation through Data Intelligence (CIDI),Center for Innovation through Data Intelligence,Center for Innovation through Data Intelligence,,,Center for Innovation through Data Intelligence (CIDI),Center for Innovation through Data Intelligence,True,True,Maryanne Schretzman,Maryanne,,Schretzman,,TRUE,Deputy Mayor for Strategic Initiatives,
NYC_GOID_000048,Central Park Conservancy,Central Park Conservancy,Active,Nonprofit Organization,,https://www.centralparknyc.org/,,,,,,,Elizabeth W. Smith,President & CEO,,,,,,,,,,,,,Central Park Conservancy,False,False,Elizabeth W. Smith,Elizabeth,W.,Smith,,,,
NYC_GOID_000050,Charter Revision Commission,Charter Revision Commission,Active,Advisory or Regulatory Organization,"The Charter Revision Commission is charged with reviewing the entire Charter of the City of New York, holding hearings in all five boroughs to solicit public input, and issuing a report outlining findings and recommendations to amend or revise the Charter.",https://www.nyc.gov/site/charter/index.page,,CRC,,,,,"Richard R. Buery, Jr.",Executive Director,https://www.nyc.gov/site/charter/contact/contact-charter.page,,,Charter Revision Commission,Charter Revision Commission,,Charter Revision Commission (CRC),,,,,Charter Revision Commission,Charter Revision Commission,True,False,Alec Schierenbeck,Alec,R.,Schierenbeck,Jr.,,,
NYC_GOID_000052,Chief Climate Officer,Chief Climate Officer,Active,Mayoral Office,,,,,,002,,2022.0,Rohit Aggarwala,Chief Climate Officer,,,,,,,,,,,,,Chief Climate Officer,True,True,Rohit Aggarwala,Rohit,,Aggarwala,,TRUE,Deputy Mayor for Operations,
NYC_GOID_000053,Chief Efficiency Officer,Chief Efficiency Officer,Active,Mayoral Office,,,,,,002,,2022.0,Denise Clay,Chief Efficiency Officer,,,,,,,Mayor's Office of Efficiency,Mayor's Office of Efficiency,,,,Mayor's Office - Chief Efficiency Officer,Chief Efficiency Officer,True,True,Denise Clay,Denise,,Clay,,TRUE,First Deputy Mayor,
NYC_GOID_000054,Chief Housing Officer,Chief Housing Officer,Reorganized,Mayoral Office,,https://www.nyc.gov/office-of-the-mayor/admin-officials.page,,,,002,,2022.0,,Chief Housing Officer,https://www.nyc.gov/office-of-the-mayor/mayor-contact.page,,,,Office of the Chief Housing Officer,,,Chief Housing Officer,,,,Mayor's Office - Chief Housing officer (Resigned in July),,False,False,,,,,,,,
NYC_GOID_000056,Child Care Advisory Board,Child Care Advisory Board,Active,Advisory or Regulatory Organization,,,,,,,,2022.0,,,,,,,,,,,,,,,Child Care Advisory Board,False,False,,,,,,,,
NYC_GOID_000057,Child Care Task Force,Child Care Task Force,Dissolved,Advisory or Regulatory Organization,,,,,,,,,,,,,,,,,,,,,,,Child Care Task Force,False,False,,,,,,,,
