RecordID,Name,NameAlphabetized,OperationalStatus,OrganizationType,Description,URL,AlternateOrFormerNames,Acronym,AlternateOrFormerAcronyms,BudgetCode,OpenDatasetsURL,FoundingYear,PrincipalOfficerName,PrincipalOfficerTitle,PrincipalOfficerContactURL,Notes,InstanceOf,Name - NYC.gov Agency List,Name - NYC.gov Mayor's Office,Name - NYC Open Data Portal,Name - ODA,Name - CPO,Name - WeGov,Name - Greenbook,Name - Checkbook,Name - HOO,Name - Ops,NYC.gov Agency Directory,Jan 2025 Org Chart,PrincipalOfficerFullName,PrincipalOfficerGivenName,PrincipalOfficerMiddleNameOrInitial,PrincipalOfficerFamilyName,PrincipalOfficerSuffix,InOrgChart,ReportsTo,ReportingNotes
NYC_GOID_000310,New York City Tourism + Conventions,"Tourism + Conventions, New York City",Active,Nonprofit Organization,,https://www.nyctourism.com/,NYC & Company,,,,,,Julie Coker,President and CEO,,,,,,,,,,,,,NYC & Company;New York City Tourism and Conventions (formerly known New York City & Company Board),False,True,Julie Coker,Julie,,Coker,,TRUE,Deputy Mayor of Housing Economic and Workforce Development,
NYC_GOID_000312,New York City Children's Cabinet,"Children's Cabinet, New York City",Active,Mayoral Office,"The NYC Children's Cabinet enables coordination and communication between government agencies and other partners that serve the City's youth. Its mission is to help align City efforts and resources towards ensuring that all of New York City's children can reach healthy, successful adulthood.",https://www.nyc.gov/site/childrenscabinet/index.page,,,,002,,2014.0,Ahsia Badi,Executive Director,https://www.nyc.gov/site/childrenscabinet/contact-us/contact-us.page,,,NYC Children's Cabinet,NYC Children's Cabinet,,Children's Cabinet,,Children's Cabinet,,,NYC Children's Cabinet,New York City Children's Cabinet,True,True,Ahsia Badi,Ahsia,,Badi,,TRUE,Deputy Mayor for Strategic Initiatives,
NYC_GOID_000314,New York City Districting Commission,"Districting Commission, New York City",Active,Advisory or Regulatory Organization,,https://www.nyc.gov/site/districting/index.page,,,,,,,,Chair,,,,,,,,,,,Districting Commission,,New York City Districting Commission,True,False,Dennis Walcott,Dennis,,Walcott,,,,
NYC_GOID_000315,New York City Emergency Management,"Emergency Management, New York City",Active,Mayoral Agency,"NYC OEM plans and prepares for emergencies, educates the public about preparedness, coordinates emergency response and recovery, and collects and disseminates emergency information.",https://www.nyc.gov/site/em/index.page,NYC Emergency Management;Office of Emergency Management,NYCEM,OEM,017,https://data.cityofnewyork.us/browse?Dataset-Information_Agency=NYC+Emergency+Management+%28NYCEM%29,1996.0,Zach Iscol,Commissioner,https://www.nyc.gov/site/em/contact/email-the-commissioner.page,,,NYC Emergency Management,NYC Emergency Management,NYC Emergency Management (NYCEM),NYC Emergency Management (NYCEM),Office of Emergency Management,Department of Emergency Management,"Emergency Management, NYC",Department of Emergency Management,NYC Emergency Management,NYC Emergency Management,True,True,Zach Iscol,Zach,,Iscol,,TRUE,Deputy Mayor for Public Safety,
NYC_GOID_000316,New York City Employee Retirement System,"Employees' Retirement System, New York City",Active,Pension Fund,"Founded in 1920, NYCERS has grown into the largest public retirement system within New York City serving over 330,000 active members and retirees. Membership in NYCERS is available to all New York City employees who are not eligible to participate in the New York City Teachers' Retirement System, the New York City Police Pension Fund, the New York City Fire Department Pension Fund or the New York City Board of Education Retirement System.",https://www.nycers.org/,,NYCERS,,,,1920.0,Melanie Whinnery,Executive Director,https://mynycers.nycers.org/MyNYCERS/s/ED-Correspondence,,,NYC Employees' Retirement System (NYCERS),NYC Employees' Retirement System (NYCERS),,NYC Employees' Retirement System (NYCERS),New York City Employees' Retirement System,Employees Retirement System,"Employees Retirement System Board of Trustees, NYC",,NYC Employee's Retirement System (NYCERS),NYC Employee Retirement System,True,False,Melanie Whinnery,Melanie,,Whinnery,,,,
NYC_GOID_000318,NYC Health + Hospitals,"Health + Hospitals, NYC",Active,Public Benefit or Development Organization,"A public health care network of hospitals, nursing homes, community health centers and a home care agency, focused on primary & preventive care for all New Yorkers regardless of ability to pay.",https://www.nychealthandhospitals.org/,,H+H,,819,,1969.0,Mitchell Katz,President and CEO,https://www.nychealthandhospitals.org/contact/,,,NYC Health + Hospitals,NYC Health + Hospitals,,NYC Health + Hospitals (H+H),,Health and Hospitals Corporation,"Health + Hospitals NYC, (NYC H+H)",Health and Hospitals Corporation,NYC Health + Hospital,NYC Health + Hospitals,True,True,Mitchell Katz,Mitchell,,Katz,,TRUE,Deputy Mayor for Health and Human Services,
NYC_GOID_000319,New York City Housing Authority,"Housing Authority, New York City",Active,Public Benefit or Development Organization,"The New York City Housing Authority (NYCHA) provides affordable housing to nearly 420,000 low- and moderate-income City residents in 345 housing developments with 180,000 apartments in the five boroughs. Through federal rent subsidies (Section 8 Leased Housing Program), the Authority assists over 87,500 families in locating and renting housing in privately owned buildings. In addition, the Authority provides social services for its residents through 112 community centers, 42 senior centers, and a variety of programs.",https://www.nyc.gov/site/nycha/index.page,,NYCHA,,,https://data.cityofnewyork.us/browse?Dataset-Information_Agency=New+York+City+Housing+Authority+%28NYCHA%29,1934.0,Lisa Bova-Hiatt,Chief Executive Officer,https://www.nyc.gov/site/nycha/about/contact.page,,,"Housing Authority, New York City (NYCHA)","Housing Authority, New York City (NYCHA)",New York City Housing Authority (NYCHA),New York City Housing Authority (NYCHA),,NYC Housing Authority,"Housing Authority, NYC",,"Housing Authority, New York City (NYCHA)",NYC Housing Authority,True,True,Lisa Bova-Hiatt,Lisa,,Bova-Hiatt,,TRUE,Deputy Mayor of Housing Economic and Workforce Development,
NYC_GOID_000320,New York City Housing Authority Board,"Housing Authority Board, New York City",Active,Advisory or Regulatory Organization,,https://www1.nyc.gov/site/nycha/about/nycha-board.page,,,,,,,Jamie Rubin,Chair,,,,,,,,,,,,,New York City Housing Authority Board,True,False,Jamie Rubin,Jamie,,Rubin,,,,
NYC_GOID_000322,New York City Municipal Insurance Company,"Municipal Insurance Company, New York City",Active,Public Benefit or Development Organization,,https://nymir.org/,,,,,,,,,,,,,,,,,,,,,New York City Municipal Insurance Company,False,False,,,,,,,,
NYC_GOID_000324,New York City Panel on Climate Change,"Panel on Climate Change, New York City",Active,Advisory or Regulatory Organization,,https://www1.nyc.gov/site/orr/challenges/nyc-panel-on-climate-change.page,,,,,,,,,,,,,,,,,,,,,New York City Panel on Climate Change,True,False,,,,,,,,
NYC_GOID_000325,New York City Public Housing Preservation Trust,"Public Housing Preservation Trust, New York City",Active,Public Benefit or Development Organization,,https://www.preservationtrust.org/,,,,,,,Vlada Kenniff,President,,,,,,,,,,,,,New York City Public Housing Preservation Trust,False,False,Vlada Kenniff,Vlada,,Kenniff,,,,
NYC_GOID_000326,"New York City School Bus Umbrella Services, Inc.","School Bus Umbrella Services, Inc., New York City",Active,Public Benefit or Development Organization,,https://www.nycsbus.com/,,,,,,,,,,,,,,,,,,,,,"New York City School Bus Umbrella Services, Inc.",False,False,,,,,,,,
NYC_GOID_000327,New York City School Support Services,"School Support Services, New York City",Active,Nonprofit Organization,,https://www.nycsss.org/,,,,,,,,,,,,,,,,,,,,,New York City School Support Services,False,False,,,,,,,,
NYC_GOID_000328,NYC Service,NYC Service,Active,Division,,https://www.nycservice.org/,,,,,https://data.cityofnewyork.us/browse?Dataset-Information_Agency=NYC+Service,,Laura Rog,Chief Service Officer,https://www.nycservice.org/contact,,,,,,,,,,,NYC Service,NYC Service,True,True,Laura Rog,Laura,,Rog,,TRUE,Deputy Mayor for Administration and Chief of Staff,
NYC_GOID_000330,New York City Transit Riders Council,"Transit Riders Council, New York City",Active,Advisory or Regulatory Organization,,https://pcac.org/nyctrc/,,,,,,,,NYCTRC Chair & MTA Board Member,,,,,,,,,,,,,New York City Transit Riders Council,True,False,Andrew Albert,Andrew,,Albert,,,,
NYC_GOID_000331,New York City Transitional Finance Authority,"Transitional Finance Authority, New York City",Active,Public Benefit or Development Organization,The New York City Transitional Finance Authority is a public benefit corporation created in 1997 to fund a portion of the capital program of the City of New York and to facilitate the capital finance program of the City.,https://www.nyc.gov/site/transitionalfinance/index.page,,TFA,,,,1997.0,David Womack,Executive Director,https://www.nyc.gov/site/transitionalfinance/about-tfa/contact-transitional-finance-authority.page,,,"Transitional Finance Authority, New York City (TFA)","Transitional Finance Authority, New York City (TFA)",,,,Transitional Finance Authority,"Transitional Finance Authority, NYC",,"Transitional Finance Authority, New York City (TFA)",NYC Transitional Finance Authority,True,False,David Womack,David,,Womack,,,,
NYC_GOID_000332,New York City Watershed Protection and Partnership Council,"Watershed Protection and Partnership Council, New York City",Active,Advisory or Regulatory Organization,,https://dos.ny.gov/new-york-city-watershed-program,,,,,,,,,,,,,,,,,,,,,New York City Watershed Protection and Partnership Council,False,False,,,,,,,,
NYC_GOID_000333,New York Community Trust Distribution Committee,New York Community Trust Distribution Committee,Active,Advisory or Regulatory Organization,,https://www.nycommunitytrust.org/,,,,,,,,Chair,,,,,,,,,,,,,New York Community Trust Distribution Committee,True,False,Jamie Drake,Jamie,,Drake,,,,
NYC_GOID_000334,New York County Public Administrator,"Public Administrator, New York County",Active,State Government Agency,,https://www.nyc.gov/site/nycountypa/index.page,,,,,,,Dahlia Damas,Public Administrator,https://www.nyc.gov/site/nycountypa/contact/contact.page,,,,,,,,,,,Public Administrator - New York County (NYCountyPA),New York County Public Administrator,True,False,Dahlia Damas,Dahlia,,Damas,,,,
NYC_GOID_000335,New York Public Library,"Public Library, New York",Active,Nonprofit Organization,"Library services are provided through three independent systems: the Brooklyn Public Library, the New York Public Library, and the Queens Library. These systems operate 208 local library branches throughout the City and four research library centers in Manhattan. The libraries offer free and open access to books, periodicals, electronic resources, and non-print materials. Reference and career services; Internet access; and educational, cultural, and recreational programming for adults, young adults, and children are also provided. The libraries' collections include 377 electronic databases and more than 65 million books, periodicals, and other circulating and reference items.",https://www.nypl.org/,,NYPL,,037,https://data.cityofnewyork.us/browse?Dataset-Information_Agency=New+York+Public+Library+%28NYPL%29,1895.0,Anthony W. Marx,President and CEO,https://www.nypl.org/get-help/contact-us,,,"Library, New York Public (NYPL)","Library, New York Public (NYPL)",New York Public Library (NYPL),New York Public Library (NYPL),,New York Public Library,New York Public Library,New York Public Library,"Library, New York Public (NYPL)",New York Public Library,False,False,Anthony W. Marx,Anthony,W.,Marx,,,,
NYC_GOID_000336,New York Research Libraries,"Research Libraries, New York",Active,Nonprofit Organization,,,,,,,,1895.0,,,,,,,,,,,,,New York Research Libraries,,,False,False,,,,,,,,
NYC_GOID_000337,Nightlife Advisory Board,Nightlife Advisory Board,Active,Advisory or Regulatory Organization,,https://www1.nyc.gov/site/mome/nightlife/nightlife.page,,,,,,,,,,,,,,,,,,,,,Nightlife Advisory Board,False,False,,,,,,TRUE,Mayor's Office of Media and Entertainment,
NYC_GOID_000338,Nonprofit Advisory Council,Nonprofit Advisory Council,Active,Advisory or Regulatory Organization,,https://www.nyc.gov/site/nonprofits/about/advisory-council.page,,,,,,,,,,,,,,,,,,,,,Nonprofit Advisory Council,False,False,,,,,,,,
NYC_GOID_000339,Nuclear Disarmament and Nuclear Weapons-Free Zone Advisory Committee,Nuclear Disarmament and Nuclear Weapons-Free Zone Advisory Committee,Active,Advisory or Regulatory Organization,,,,,,,,,,,,,,,,,,,,,,,Nuclear Disarmament and Nuclear Weapons-Free Zone Advisory Committee,False,False,,,,,,,,
NYC_GOID_000340,NYPD Domestic and Gender-Based Violence Training Committee,NYPD Domestic and Gender-Based Violence Training Committee,Active,Advisory or Regulatory Organization,,,,,,,,,,,,,,,,,,,,,,,NYPD Domestic and Gender-Based Violence Training Committee,False,False,,,,,,,,
NYC_GOID_000341,NYPD Pension Fund Board of Trustees,NYPD Pension Fund Board of Trustees,Active,Advisory or Regulatory Organization,,https://www.nyc.gov/content/nycppf/pages/,,,,,,,Kevin Holloran,Executive Director,,,,,,,,,,,,,NYPD Pension Fund Board of Trustees,True,False,Kevin Holloran,Kevin,,Holloran,,,,
NYC_GOID_000343,New York City Office of the Actuary,"Actuary, New York City Office of the",Active,Advisory or Regulatory Organization,"The New York City Office of the Actuary (""NYCOA"") provides actuarial information and services for the five major actuarially-funded New York City Retirement Systems (NYCERS), nine Variable Supplement Funds (VSFs), two Tax Deferred Annuity (TDA) Programs, six Group Life Insurance Funds, three Closed Pension Funds and the New York City Health Benefits Program.",https://www.nyc.gov/site/actuary/index.page,,NYCOA,,008,,1914.0,Marek Tyszkiewicz,Chief Actuary,https://www1.nyc.gov/site/actuary/contactus/email-the-office.page,,,"Actuary, NYC Office of the (NYCOA)","Actuary, NYC Office of the (NYCOA)",,Office of the Actuary,Office of the Actuary,Office of the Actuary,"Actuary, Office of",Office of the Actuary,"Actuary, NYC Office of the (NYCOA)",Office of the Actuary,True,False,Marek Tyszkiewicz,Marek,,Tyszkiewicz,,,,
NYC_GOID_000344,Office of the Administrative Justice Coordinator,"Administrative Justice Coordinator, Office of the",Active,Mayoral Office,"The Office of the Administrative Justice Coordinator (AJC) works to improve the professionalism, efficiency, transparency, and accountability of the City's administrative tribunals. The Office works with the tribunals to establish and implement Rules of Conduct for Administrative Law Judges, improve the training and recruitment of Administrative Law Judges, and enhance the public's understanding of and access to the administrative justice system.",https://www.nyc.gov/site/ajc/index.page,,AJC,,002,,,Deborah Maher,President,https://www.nyc.gov/site/ajc/about/email-the-administrative-justice-coordinator.page,,,"Administrative Justice Coordinator, NYC Office of  (AJC)","Administrative Justice Coordinator, NYC Office of  (AJC)",,Office of the Administrative Justice Coordinator (AJC),,Office of Administrative Justice Coordinator,,,"Administrative Justice Coordinator, NYC Office of (AJC)",Office of Administrative Justice Coordinator,True,True,Deborah Maher,Deborah,B.,Maher,,TRUE,Chief Counsel to the Mayor and City Hall,
NYC_GOID_000345,Office of Administrative Tax Appeals,"Administrative Tax Appeals, Office of",Active,Mayoral Agency,"The Office of Administrative Tax Appeals was established by Local Law 57 of 2007 to bring together the agencies that provide fair, independent and efficient appeals of the taxes administered by the City of New York.",https://www.nyc.gov/site/oata/index.page,,OATA,,021,,2007.0,Neil Schaier,Director,,,,"Administrative Tax Appeals, Office of","Administrative Tax Appeals, Office of",,Office of Administrative Tax Appeals (OATA),Office of Administrative Tax Appeals,Office of Administrative Tax Appeals,"Tax Appeals, Office Of Administrative",Office of Administrative Tax Appeals,"Administrative Tax Appeals, Office of",Office of Administrative Tax Appeals,True,False,Neil Schaier,Neil,,Schaier,,,,
NYC_GOID_000346,Office of Administrative Trials and Hearings,"Administrative Trials and Hearings, Office of",Active,Mayoral Agency,The NYC Office of Administrative Trials and Hearings (OATH) is an independent city agency responsible for holding administrative hearings on cases that are filed by other NYC agencies. OATH is comprised of four different administrative tribunals: the Environmental Control Board; OATH Health Tribunal; OATH Taxi Tribunal and OATH Tribunal.,https://www.nyc.gov/site/oath/index.page,,OATH,,820,https://data.cityofnewyork.us/browse?Dataset-Information_Agency=Office+of+Administrative+Trials+and+Hearings+%28OATH%29,1979.0,Asim Rehman,Commissioner,https://www.nyc.gov/site/oath/about/contact-the-commissioner-online-form.page,,,"Administrative Trials and Hearings, Office of (OATH)","Administrative Trials and Hearings, Office of (OATH)",Office of Administrative Trials and Hearings (OATH),Office of Administrative Trials and Hearings (OATH),Office of Administrative Trial and Hearings,Office of Administrative Trials and Hearings,"Administrative Trials And Hearings, Office of",Office of Administrative Trials and Hearings,"Administrative Trials and Hearings, Office of (OATH)",Office of Administrative Trials and Hearings,True,True,Asim Rehman,Asim,,Rehman,,TRUE,Chief Counsel to the Mayor and City Hall,
NYC_GOID_000347,Office of Asylum Seeker Operations,"Asylum Seeker Operations, Office of",Active,Mayoral Office,"The NYC Office of Asylum Seeker Operations (OASO) work recognizes the city's response to the emerging asylum seekers' migration from the border to our city. Created in March 2023, OASO is primarily responsible for overseeing and coordinating all support services for asylum seekers and their families.",https://www.nyc.gov/site/asylumseekers/index.page,,OASO,,002,,2023.0,Molly Schaeffer,Director,https://www.nyc.gov/site/asylumseekers/contact/contact-office-of-asylum-seeker-operations.page,,,"Asylum Seeker Operations, Office of","Asylum Seeker Operations, Office of",,NYC Office of Asylum Seeker Operations (OASO),,,,,"Asylum Seeker Operations, Office of",Office of Asylum Seeker Operations,True,True,Molly Schaeffer,Molly,,Schaeffer,,TRUE,Deputy Mayor for Administration and Chief of Staff,
NYC_GOID_000349,Office of Capital Project Development,"Capital Project Development, Office of",Active,Mayoral Office,,,,,,002,,,,,,,,,,,,,,,,,Office of Capital Project Development,False,True,,,,,,TRUE,Deputy Mayor for Operations,
NYC_GOID_000351,Mayor's Office for Childcare and Early Childhood Education,"Child Care and Early Childhood Education, Mayor's Office for",Active,Mayoral Office,"The Office for Child Care and Early Childhood Education's mission is to ensure New York City families have access to equitable, high-quality, and affordable early education and care and builds off of Mayor Adams' Blueprint for Child Care and Early Childhood Education.",https://www.nyc.gov/site/childcare/index.page,,OCCECE,,002,,2023.0,Amber Cartwright,Executive Director,https://www.nyc.gov/site/childcare/contact/contact-us.page,,,"Child Care and Early Childhood Education, Office for (OCCECE)","Child Care and Early Childhood Education, Office for (OCCECE)",,Mayor's Office for Child Care and Early Childhood Education,,,,,"Child Care and Early Childhood Education, Office for (OCCECE)",Office of Childcare and Early Childhood Education,True,True,Amber Cartwright,Amber,,Cartwright,,TRUE,Deputy Mayor for Strategic Initiatives,
NYC_GOID_000353,Office of Climate Resiliency,"Climate Resiliency, Office of",Reorganized,Mayoral Office,,,,MOCR,,002,,,,,,,,,,,Office of Climate Resiliency (MOCR),,,,,,,False,False,,,,,,,,
NYC_GOID_000354,Office of Collective Bargaining,"Collective Bargaining, Office of",Active,Advisory or Regulatory Organization,,https://www.ocb-nyc.org/,,OCB,,313,,1967.0,,,,,,,,,Office of Collective Bargaining (OCB),Office of Collective Bargaining,Office of Collective Bargaining,"Collective Bargaining, Office of",Office of Collective Bargaining,,,True,False,,,,,,,,
NYC_GOID_000355,Office of Community Hiring,"Community Hiring, Office of",Active,Division,The Office of Community Hiring (OCH)'s mission is to use the City's purchasing power to drive economic mobility by connecting City vendors with a pipeline of talent and creating pathways to careers for our community.,https://www.nyc.gov/site/communityhiring/index.page,,,,002,,2023.0,Doug Lipari,Executive Director,https://www.nyc.gov/site/communityhiring/about/contact-us.page,,,"Community Hiring, Office of","Community Hiring, Office of",,,,,,,"Community Hiring, Office of",Office of Community Hiring,True,False,Doug Lipari,Doug,,Lipari,,,Mayor's Office of Talent and Workforce Development,
NYC_GOID_000356,Mayor's Office of Community Mental Health,"Community Mental Health, Mayor's Office of",Active,Mayoral Office,The Mayor's Office of Community Mental Health promotes mental health for all New Yorkers.  The office works to ensure New Yorkers get the mental health treatment they need and fewer mental health needs become crises.,https://mentalhealth.cityofnewyork.us/,,,OCMH,002,https://data.cityofnewyork.us/browse?Dataset-Information_Agency=Mayor%27s+Office+of+Community+Mental+Health+%28OCMH%29,2019.0,Michael Appleton,Director,https://mentalhealth.cityofnewyork.us/contact-us,,,Mayor's Office of Community Mental Health,Mayor's Office of Community Mental Health,Mayor's Office of Community Mental Health (OCMH),Mayor's Office of Community Mental Health (OCMH),Mayor's Office of Community Mental Health,Office of Community Mental Health,,,Mayor's Office of Community Mental Health,Office of Community Mental Health,True,True,Eva Wong,Eva,,Wong,,TRUE,Deputy Mayor for Health and Human Services,
NYC_GOID_000361,Mayor's Office of Innovation and Emerging Markets,"Innovation and Emerging Markets, Mayor's Office of",Active,Mayoral Office,,,,,,002,,2023.0,,,,,,,,,Mayor's Office of Innovation and Emerging Markets,,,,,,Office of Emerging Markets,False,True,Denise Felipe-Adams and Jonathan Salomons,,,,,TRUE,Deputy Mayor for Administration and Chief of Staff,
NYC_GOID_000362,Mayor's Office of Engagement,"Engagement, Mayor's Office of",Active,Mayoral Office,,,,,,002,,2022.0,,,,,,,,,Mayor's Office of Engagement,,,,,,Office of Engagement,False,True,,,,,,TRUE,Deputy Mayor for Administration and Chief of Staff,
NYC_GOID_000363,Mayor's Office of Environmental Coordination,"Environmental Coordination, Mayor's Office of",Active,Mayoral Office,MOEC's mission is to be a resource for city agencies and private applicants by providing information and assistance in completing the environmental review process and to help the city to lead by example in applying state-of-the-art green building requirements.,https://www.nyc.gov/site/oec/index.page,,MOEC,,002,https://data.cityofnewyork.us/browse?Dataset-Information_Agency=Mayor%27s+Office+of+Environmental+Coordination+%28MOEC%29,2011.0,Hilary Semel,Director,https://www.nyc.gov/site/oec/about/email-the-director.page,,,"Environmental Coordination, Mayor's Office of (MOEC)","Environmental Coordination, Mayor's Office of (MOEC)",Mayor's Office of Environmental Coordination (MOEC),Office of Environmental Coordination (MOEC),Mayor's Office of Environmental Coordination,Office of Environmental Coordination,,,"Enviormental Coordination, Mayor's Office of (MOEC)",Office of Environmental Coordination,True,True,Hilary Semel,Hilary,,Semel,,TRUE,Mayor's Office of Climate and Environmental Justice,
NYC_GOID_000364,Mayor's Office of Environmental Remediation,"Environmental Remediation, Mayor's Office of",Active,Mayoral Office,"The Office of Environmental Remediation (OER) is responsible for the implementation of the brownfield cleanup and redevelopment initiatives outlined in PlaNYC, the City's comprehensive sustainability plan, to support environmental cleanup and economic redevelopment. In August 2010, Mayor Bloomberg launched the New York City Brownfield Cleanup Program (NYC BCP), the nation's first municipal cleanup program, which offers oversight and liability protection to developers and property owners for sites with light to moderate contamination. OER's Brownfield Incentive Grant (BIG) program provides financial incentives and technical support to developers and community organizations. OER also directs the NYC E-Designation Review Program for Hazardous Materials, Air Quality, and Noise and conducts brownfield educational workshops and outreach activities to support meaningful community engagement in brownfields redevelopment.",https://www.nyc.gov/site/oer/index.page,,OER,,002,https://data.cityofnewyork.us/browse?Dataset-Information_Agency=Mayor%27s+Office+of+Environmental+Remediation+%28OER%29,2010.0,Shaminder Chawla,Director,https://www.nyc.gov/site/oer/contact/contact-form.page,,,Mayor's Office of Environmental Remediation (OER),Mayor's Office of Environmental Remediation (OER),Mayor's Office of Environmental Remediation (OER),Office of Environmental Remediation (OER),Mayor's Office of Environmental Remediation,Office of Environmental Remediation,,,Mayor's Office of Environmental Remediation (OER),Office of Environmental Remediation,True,True,Shaminder Chawla,Shaminder,,Chawla,,TRUE,Mayor's Office of Climate and Environmental Justice,
NYC_GOID_000367,Office of Healthcare Accountability,"Healthcare Accountability, Office of",Active,Mayoral Office,,,,,,002,,2023.0,,,,,,,,,,,,,,,,False,False,,,,,,,,
