moa_entity_name,moa_url,moa_description,nycgo_record_id,nycgo_name,similarity_score,match_confidence,needs_manual_review,notes
Quadrennial Advisory Commission for the Review of Compensation Levels of Elected Officials,,"The Quadrennial Advisory Commission for the Review of Compensation Levels of Elected Officials studies the compensation levels for the Mayor, Public Advocate, Comptroller, Borough Presidents, City Cou",,,0.436,none,yes,
Queens Borough Public Library - Board of Trustees,https://www.queenslibrary.org/about-us/queens-public-library-overview/leadership/board-of-trustees,The Queens Borough Public Library Board of Trustees determines policies and oversees management of the Queens public library system.,NYC_GOID_000402,Queens Public Library,0.6,low,yes,
"Randall's Island Park Alliance, Inc.",https://randallsisland.org/,The Randall's Island Park Alliance has an operating agreement with the NYC Department of Parks and Recreation for the development and improvement of Randall's Island.,NYC_GOID_000405,Randall's Island Park Alliance,0.938,medium,no,
Rent Guidelines Board,https://rentguidelinesboard.cityofnewyork.us/,The Rent Guidelines Board sets rent adjustment levels for apartments subject to the Rent Stabilization Law.,NYC_GOID_000408,Rent Guidelines Board,1.0,exact,no,
Roosevelt Island Operating Corporation - Board of Directors,https://rioc.ny.gov/149/Board-of-Directors,"The Roosevelt Island Operating Corporation is a public benefit corporation that operates, manages and develops Roosevelt Island.",NYC_GOID_000414,Roosevelt Island Operating Corporation,0.784,low,yes,
School Construction Authority - Board of Trustees,http://www.nycsca.org/Quick-Links-Home/About-the-SCA/SCA-Board-of-Trustees,"The School Construction Authority is responsible for the design, construction, modernization and rehabilitation of public schools in New York City.",NYC_GOID_000416,School Construction Authority,0.744,low,yes,
Senior Advisory Council,https://www1.nyc.gov/site/dfta/about/advisory-council.page,The Department for the Againg Advisory Council makes recommendations to and advises the Commissioner of the Department.,NYC_GOID_000418,Senior Advisory Council,1.0,exact,no,
Soil & Water Conservation District Board - Board of Directors,https://www.soilandwater.nyc/,"The Soil and Water Conservation District is part of a nationwide system of 3,000 districts. It assists New Yorkers and local decision-makers in making wise use of the City's soil, water and related re",NYC_GOID_000424,Soil and Water Conservation District,0.68,low,yes,
State Fire Prevention and Building Code Council,https://dos.ny.gov/state-fire-prevention-and-building-code-council,"The State Fire Prevention and Building Code Council is empowered to maintain and periodically update the Uniform Fire Prevention and Building Code and State Energy Conservation Construction Code, and ",NYC_GOID_000427,State Fire Prevention and Building Code Council,1.0,exact,no,
SWMP Converted Marine Transfer Station Community Advisory Group - Gansevoort (Manhattan),,"The Community Advisory Group advises the Mayor and other elected officials on the development, construction and operation of the Gansevoort Marine Transfer Station.",,,0.51,none,yes,
Tax Appeals Tribunal - Office of Administrative Tax Appeals,https://www1.nyc.gov/site/taxappeals/about/about.page,The Tax Appeals Tribunal has the jurisdiction to hear and determine cases initiated by the filing of petitions protesting notices issued by the Commissioner of Finance involving NYC-administered taxes,NYC_GOID_000345,Office of Administrative Tax Appeals,0.758,low,yes,
Tax Commission - Office of Administrative Tax Appeals,https://www1.nyc.gov/site/taxcommission/index.page,"New York City's Tax Commission is the administrative review body for hearing protests of property tax assessments set by the Department of Finance, and, when appropriate, for correcting such assessmen",NYC_GOID_000345,Office of Administrative Tax Appeals,0.809,medium,no,
Taxi and Limousine Commission,https://www1.nyc.gov/site/tlc/index.page,The Taxi and Limousine Commission licenses and regulates the taxi and limousine industries in New York City.,NYC_GOID_000436,New York City Taxi and Limousine Commission,1.0,exact,no,
Taxi and Limousine Commission Advisory Board,,The Taxi and Limousine Commission Advisory Board enables the commission to be kept aware of current views of all segments of the industries regulated by the commission and of the public and to be avai,NYC_GOID_000436,New York City Taxi and Limousine Commission,0.795,low,yes,
Teachers' Retirement Board - Teachers' Retirement System,https://www.trsnyc.org/memberportal/About-Us/ourRetirementBoard,The Teachers' Retirement Board oversees and acts as fiduciary for the New York City teachers' pension fund.,,,0.565,none,yes,
Technology Development Corporation,,The NYC Technology Development Corporation is a non-profit organization serving New York City by providing standardized information technology project support to selected agency projects through the c,NYC_GOID_000177,Economic Development Corporation,0.848,medium,no,
"Theater Subdistrict Council, LDC",,"The Theatre Subdistrict Council administers the Theater Subdistrict Fund and allocates grants with the goal of promoting the production of new theater work, developing new audiences, and showcasing Br",NYC_GOID_000442,Theater Subdistrict Council Local Development Corporation,0.705,low,yes,
Transit Riders Council - NYC Transit Authority Advisory Council,https://pcac.org/about/,The Transit Riders Council is one of three advisory councils that make up the Permanent Citizens Advisory Committee (PCAC) of the Metropolitan Transportation Authority (MTA). The mission of the PCAC i,NYC_GOID_000330,New York City Transit Riders Council,0.701,low,yes,
Trust for Cultural Resources,,The Trust for Cultural Resources was established to provide assistance to eligible museums and other participating cultural institutions to expand their facilities and increase their revenues through ,NYC_GOID_000448,Trust for Cultural Resources,1.0,exact,no,
United Nations Development Corporations,https://undc.org/,The United Nations Development Corporation is a New York State public benefit corporation that assists the United Nations community with its office space and other real estate needs. Among its most im,NYC_GOID_000452,United Nations Development Corporation,0.987,high,no,
Veterans' Advisory Board - Mayor's Office of Veterans' Affairs,https://www1.nyc.gov/site/veterans/community/veterans-advisory-board.page,"The Veterans' Advisory Board advises the Director of Veterans' Affairs on all matters concerning veterans, determines its own rules of procedure, and submits an annual report of its activities to the ",,,0.598,none,yes,
Voter Assistance Advisory Committee,http://www.nyccfb.info/about/vaac,"The Voter Assistance Advisory Committee shall assist the Campaign Finance Board with its duties and responsibilities, including but not limited to overseeing the voter assistance program.",NYC_GOID_000458,Voter Assistance Advisory Committee,1.0,exact,no,
Water Board,https://www1.nyc.gov/site/nycwaterboard/index.page,"The New York City Water Board's mission is to establish rates for and distribute the collected revenues of the Water and Sewer System of the City of New York, proactively considering the optimal level",NYC_GOID_000459,New York City Water Board,1.0,high,no,
Waterfront Management Advisory Board,,"The Waterfront Management Advisory Board shall consult with and advise the Deputy Mayor for Economic Development, the Commissioner of Small Business Services, and the City Planning Commission on any m",NYC_GOID_000460,Waterfront Management Advisory Board,1.0,exact,no,
Workforce Development Board,,The Workforce Development Board's responsibilities include developing the City's strategy under the Workforce Innovation and Opportunity Act (WIOA) to improve the skills of New York's workforce to bet,NYC_GOID_000461,Workforce Development Board,1.0,exact,no,
"World Trade Center Captive Insurance Company, Inc.",,The World Trade Center Captive Insurance Company is a public benefit corporation formed to provide insurance for risks incurred by the City of New York and its affiliated companies related to the atta,NYC_GOID_000465,Perelman Performing Arts Center,0.607,low,yes,
World Trade Center Memorial Foundation - Board of Directors National September 11 Memorial and Museum at the WTC,https://www.911memorial.org/about/board-trustees,"The National September 11 Memorial & Museum will build, program, own and operate the memorial and museum at Ground Zero that have been planned by the Lower Manhattan Development Corporation.",,,0.536,none,yes,
Young Men's Initiative Advisory Board,http://www.nyc.gov/html/ymi/html/about/advisory-board.shtml,"The purpose of the Young Men's Initiative Advisory Board is to advise, advocate and support YMI initiatives and policies that will strengthen opportunity, access, and angagement for young men of color",NYC_GOID_100025,Young Men's Initiative Advisory Board,1.0,exact,no,
Youth Board (DYCD),https://www1.nyc.gov/site/dycd/involved/boards-and-councils/nyc-youth-board.page,The Youth Board advises the Department of Youth and Community Development on the development of youth programs.,NYC_GOID_100026,Youth Board,0.759,low,yes,
